original_title,title_length,production_companies
Mamma Mia!,10,"Universal Pictures, Internationale Filmproduktion Richter, Playtone, Relativity Media, Littlestar"
The Curious Case of Benjamin Button,35,"Paramount Pictures, Warner Bros., Kennedy/Marshall Company, The"
The Mummy: Tomb of the Dragon Emperor,37,"Universal Pictures, China Film Co-Production Corporation, Relativity Media, Alphaville Films, Sommers Company, The"
The Incredible Hulk,19,"Universal Pictures, Marvel Studios, Valhalla Motion Pictures, MVL Incredible Productions"
Gran Torino,11,"Village Roadshow Pictures, Malpaso Productions, Gerber Pictures, Warner Bros., Double Nickel Entertainment"
Madagascar: Escape 2 Africa,27,DreamWorks Animation
Hellboy II: The Golden Army,27,"Universal Pictures, Dark Horse Entertainment, Lawrence Gordon Productions, Mid Atlantic Films, Relativity Media"
Jumper,6,"Dune Entertainment, Hypnotic, New Regency Pictures"
Journey to the Center of the Earth,34,"New Line Cinema, Walden Media"
Wanted,6,"Universal Pictures, Spyglass Entertainment, Bazelevs Production, Kickstart Productions, Marc Platt Productions"
Slumdog Millionaire,19,"Celador Films, Warner Bros., Film4"
Transporter 3,13,"Europa Corp, TF1 Films Production, Grive Productions, EuropaCorp"
Valkyrie,8,"United Artists, Achte Babelsberg Film, Metro-Goldwyn-Mayer (MGM), Bad Hat Harry Productions"
"10,000 BC",9,"Centropolis Entertainment, Legendary Pictures, Warner Bros., Moonlighting Films, The Department of Trade and Industry of South Africa"
Hancock,7,"Columbia Pictures, Weed Road Pictures, Forward Pass, Relativity Media, Overbrook Entertainment"
The Hurt Locker,15,"Summit Entertainment, Kingsgate Films, Grosvenor Park Media Ltd., Voltage Pictures, Film Capital Europe Funds (FCEF )"
What Happens in Vegas,21,"Twentieth Century Fox Film Corporation, Regency Enterprises, Mosaic Media Group, 21 Laps Entertainment, Penn Station Entertainment"
The Chronicles of Narnia: Prince Caspian,40,"Walt Disney, Walden Media, Stillking Films, Ozumi Films, Propeler"
Tropic Thunder,14,"DreamWorks SKG, Goldcrest Pictures, Red Hour Films, Internationale Filmproduktion Stella-del-Sud Second"
Eagle Eye,9,"DreamWorks SKG, K/O Paper Products, Goldcrest Pictures, KMP Film Invest"
The Boy in the Striped Pyjamas,30,"Miramax Films, BBC Films, Heyday Films"
Rambo,5,"Rogue Marble, Nu Image Films, Lionsgate, Millennium Films, Emmett/Furla Films"
Death Race,10,"Universal Pictures, Cruise/Wagner Productions, Impact Pictures, Relativity Media, Scion Films"
Step Up 2: The Streets,22,"Summit Entertainment, Offspring Entertainment, Touchstone Pictures"
The Day the Earth Stood Still,29,"Twentieth Century Fox Film Corporation, Dune Entertainment III, Earth Canada Productions, Hammerhead Productions, 3 Arts Entertainment"
Seven Pounds,12,"Columbia Pictures, Escape Artists, Relativity Media, Overbrook Entertainment"
Cloverfield,11,"Paramount Pictures, Bad Robot"
Bolt,4,"Walt Disney Pictures, Walt Disney Animation Studios"
Forgetting Sarah Marshall,25,"Universal Pictures, Apatow Productions"
Australia,9,"Bazmark Films, Ingenious Film Partners, Twentieth Century Fox Film Corporation, Dune Entertainment III, ScreenWest"
Yes Man,7,"The Zanuck Company, Heyday films, Warner Bros."
Marley & Me,11,"Sunswept Entertainment, Dune Entertainment III"
Body of Lies,12,"Scott Free Productions, De Line Pictures, Warner Bros."
Burn After Reading,18,"Mike Zoss Productions, Studio Canal, Relativity Media, Focus Features, Working Title Films"
27 Dresses,10,"Spyglass Entertainment, Fox 2000 Pictures, Dune Entertainment III"
Inkheart,8,"New Line Cinema, Internationale Filmproduktion Blackbird Erste"
21,2,"Columbia Pictures, Relativity Media"
Step Brothers,13,"Columbia Pictures, Mosaic Media Group, Gary Sanchez Productions, Relativity Media, Apatow Productions"
Fool's Gold,11,"De Line Pictures, Warner Bros."
Never Back Down,15,"Summit Entertainment, Mandalay Pictures, Baumgarten Management and Productions (BMP)"
Pineapple Express,17,"Columbia Pictures, Apatow Productions"
The Wrestler,12,"Saturn Films, Wild Bunch, Protozoa Pictures, Top Rope"
Bedtime Stories,15,"Walt Disney Pictures, Happy Madison Productions, Gunn Films"
Punisher: War Zone,18,"Lionsgate, MHF Zweite Academy Film, Marvel Knights, Valhalla Motion Pictures, SGF Entertainment"
Max Payne,9,"Dune Entertainment, Firm Films, Collision Entertainment, Abandon Entertainment, Foxtor Productions"
Mirrors,7,"Regency Enterprises, Castel Film Romania, ASAF, New Regency Pictures, Luna Pictures"
Vantage Point,13,"Columbia Pictures, Original Film, Kanzaman, Relativity Media, Art In Motion"
Zack and Miri Make a Porno,26,"Blue Askew, View Askew Productions"
Get Smart,9,"Village Roadshow Pictures, Atlas Entertainment, Mosaic Media Group, Mad Chance, Warner Bros."
Role Models,11,"Universal Pictures, Internationale Filmproduktion Stella-del-Süd, Relativity Media, New Regency Pictures, WideAwake"
Babylon A.D.,12,"StudioCanal, M6 Films, Canal+, CinéCinéma, Babylon"
In Bruges,9,"Blueprint Pictures, Scion Films, Film4, Focus Features, Twins Financing"
Changeling,10,"Imagine Entertainment, Malpaso Productions, Relativity Media"
The Spiderwick Chronicles,25,"Paramount Pictures, The Kennedy/Marshall Company"
Harold & Kumar Escape from Guantanamo Bay,41,New Line Cinema
Street Kings,12,"Fox Searchlight Pictures, Regency Enterprises, Dune Entertainment III, Emmett/Furla Films"
Nick and Norah's Infinite Playlist,34,"Columbia Pictures, Mandate Pictures, Depth of Field, Screen Gems"
Four Christmases,16,"New Line Cinema, Spyglass Entertainment, Type A Films, Ott Medien, Wild West Picture Show Productions"
The House Bunny,15,"Columbia Pictures, Happy Madison Productions, Relativity Media, Alta Loma Entertainment"
Saw V,5,"Lionsgate, Twisted Pictures"
The Love Guru,13,"Paramount Pictures, Goldcrest Pictures, Internationale Filmproduktion"
Speed Racer,11,"Village Roadshow Pictures, Studio Babelsberg, Anarchos Productions, Silver Pictures, Warner Bros."
Vicky Cristina Barcelona,24,"The Weinstein Company, Gravier Productions, Antena 3 Films, Televisió de Catalunya (TV3), Antena 3 Televisión"
Horton Hears a Who!,19,"Twentieth Century Fox Film Corporation, Blue Sky Studios, Twentieth Century Fox Animation"
The Forbidden Kingdom,21,"Casey Silver Productions, China Film Co-Production Corporation, Huayi Brothers, Relativity Media"
Righteous Kill,14,"Grosvenor Park Media Ltd., InVenture Entertainment, Millennium Films, Emmett/Furla Films, Nu-Image Films"
Transsiberian,13,"Lietuvos Kinostudija, Scout Productions, Telecinco Cinema, Castelao Producciones, Canal+ España"
You Don't Mess With the Zohan,29,"Columbia Pictures, Happy Madison Productions, Sony Pictures Releasing"
Defiance,8,"Paramount Vantage, Grosvenor Park Productions, Bedford Falls Company, The, Defiance Productions, Pistachio Pictures"
Untraceable,11,"Lakeshore Entertainment, Cohen/Pearl Productions, Screen Gems"
The Strangers,13,"Rogue Pictures, Vertigo Entertainment"
Milk,4,Focus Features
Outlander,9,"Ascendant Pictures, Rising Star, VIP Medienfonds 4, Virtual Films, Outlander Productions"
The X Files: I Want to Believe,30,"Twentieth Century Fox Film Corporation, Ten Thirteen Productions, Dune Entertainment III, Crying Box Productions"
Doubt,5,Miramax Films
City of Ember,13,"Playtone, Walden Media"
Made of Honor,13,"Columbia Pictures, Original Film"
Deception,9,"Rifkin-Eberts, Dune Entertainment III, Seed Productions"
RockNRolla,10,"StudioCanal, Dark Castle Entertainment, Toff Guy Films, Warner Bros."
The Eye,7,"Paramount Vantage, VN Productions"
Bangkok Dangerous,17,"Virtual Studios, Initial Entertainment Group, Saturn Films, International Production Company, Blue Star Pictures"
Meet the Spartans,17,"Regency Enterprises, New Regency Pictures"
The Spirit,10,"DC Comics, Lionsgate, Odd Lot Entertainment, Media Magik Entertainment, Dark Lot Entertainment"
The Happening,13,"Spyglass Entertainment, Twentieth Century Fox Film Corporation, Dune Entertainment, UTV Motion Pictures, Blinding Edge Pictures"
Doomsday,8,"Rogue Pictures, Intrepid Pictures, Scion Films, Moonlighting Films, Internationale Filmproduktion Blackbird Dritte"
The Secret of Moonacre,22,"South Pacific Pictures, Metropolitan Filmexport, Spice Factory, UK Film Council, The Australian Film Commission"
Sex and the City,16,"New Line Cinema, Darren Star Productions, Home Box Office (HBO)"
The Rocker,10,Fox Atomic
The Tale of Despereaux,22,Universal Pictures Corporation
Superhero Movie,15,Dimension Films
The Secret Life of Bees,23,Fox Searchlight Pictures
Beverly Hills Chihuahua,23,Walt Disney Pictures
Revolutionary Road,18,"DreamWorks SKG, Scott Rudin Productions, BBC Films, Neal Street Productions, Evamere Entertainment"
Baby Mama,9,"Relativity Media, Michaels-Goldwyn"
Brideshead Revisited,20,"BBC Films, Ecosse Films, HanWay Films, UK Film Council, 2 Entertain"
The Brothers Bloom,18,"The Weinstein Company, Summit Entertainment, Endgame Entertainment"
Meet Dave,9,"20th Century Fox, Regency Enterprises, Guy Walks into a Bar Productions, Deep River Productions"
Quarantine,10,"Vertigo Entertainment, Screen Gems, Andale Pictures"
The Express,11,"Davis Entertainment, Relativity Media, IDEA Filmproduktions"
Space Chimps,12,"Starz Media, Starz Animation, Odyssey Entertainment, Studiopolis, Vanguard Animation"
Lakeview Terrace,16,"Screen Gems, Overbrook Entertainment"
What Just Happened,18,"2929 Productions, Linson Entertainment, Art Linson Productions, Tribeca Productions"
Disaster Movie,14,"Grosvenor Park Media Ltd., LionsGate, 3 in the Box"
My Best Friend's Girl,21,"Lionsgate, New Wave Entertainment, Management 360, Terra Firma Films, Superfinger Entertainment"
The Midnight Meat Train,23,"Lions Gate Films, Lakeshore Entertainment, GreeneStreet Films, Midnight Picture Show"
Mutant Chronicles,17,"Isle of Man Film, Edward R. Pressman Film, Paradox Entertainment, First Foot Films"
Swing Vote,10,Touchstone Pictures
W.,2,"Ixtlan Productions, Emperor Motion Pictures, Global Entertainment Group"
Smart People,12,"Miramax Films, Sherazade Film Development, Groundswell Productions, QED International, Corduroy Films"
Nim's Island,12,Walden Media
Igor,4,"Exodus Film Group, Exodus Productions"
How to Lose Friends & Alienate People,37,"UK Film Council, Intandem Films, Aramid Entertainment Fund, Film4, Lipsync Productions"
Welcome Home Roscoe Jenkins,27,"Universal Pictures, Spyglass Entertainment"
Captain America: The First Avenger,34,Marvel Studios
Drive,5,"Bold Films, Marc Platt Productions, Odd Lot Entertainment, FilmDistrict, Motel Movies"
Harry Potter and the Deathly Hallows: Part 2,44,"Warner Bros., Heyday Films, Moving Picture Company (MPC)"
Pirates of the Caribbean: On Stranger Tides,43,"Walt Disney Pictures, Jerry Bruckheimer Films, Moving Picture Company (MPC)"
Rise of the Planet of the Apes,30,20th Century Fox
Thor,4,"Marvel Studios, Marvel Entertainment"
In Time,7,"Regency Enterprises, Strike Entertainment, New Regency Pictures"
Drive Angry,11,"Summit Entertainment, Saturn Films, Nu Image Films, Millennium Films, Michael De Luca Productions"
The Mechanic,12,"CBS Films, Millennium Films, Chartoff-Winkler Productions, Scared Productions, Nu Image Entertainment GmbH"
Source Code,11,"The Mark Gordon Company, Vendome Pictures"
Mission: Impossible - Ghost Protocol,36,"Paramount Pictures, Skydance Productions, Bad Robot, TC Productions, Revolution Sun Studios"
"Crazy, Stupid, Love.",20,Warner Bros.
The Girl with the Dragon Tattoo,31,"Columbia Pictures, Scott Rudin Productions, Film Rites, Metro-Goldwyn-Mayer (MGM), Yellow Bird"
Limitless,9,"Rogue Pictures, Relativity Media, Virgin Produced, Many Rivers Productions, Boy of the Year"
Kung Fu Panda 2,15,DreamWorks Animation
Just Go With It,15,"Columbia Pictures, Happy Madison Productions"
Horrible Bosses,15,"New Line Cinema, Rat Entertainment"
Real Steel,10,"DreamWorks SKG, 21 Laps Entertainment, Reliance Entertainment, Touchstone Pictures, ImageMovers"
Friends with Benefits,21,"Castle Rock Entertainment, Screen Gems, Olive Bridge Entertainment"
Bad Teacher,11,"Columbia Pictures, Mosaic Media Group"
Sherlock Holmes: A Game of Shadows,34,"Village Roadshow Pictures, Silver Pictures, Lin Pictures, Warner Bros., Wigram Productions"
Cars 2,6,"Walt Disney Pictures, Pixar Animation Studios"
Green Lantern,13,"De Line Pictures, Warner Bros., DC Entertainment"
The Hangover Part II,20,"Legendary Pictures, Living Films, Green Hat Films, Warner Bros."
No Strings Attached,19,"Paramount Pictures, Spyglass Entertainment, Katalyst Films, Cold Spring Pictures, Montecito Picture Company, The"
The Adventures of Tintin,24,"Paramount Pictures, Columbia Pictures, WingNut Films, Amblin Entertainment, Nickelodeon Movies"
Bridesmaids,11,"Universal Pictures, Relativity Media, Apatow Productions"
Hall Pass,9,"New Line Cinema, Conundrum Entertainment"
Super 8,7,"Paramount Pictures, Amblin Entertainment, Bad Robot, K/O Camera Toys"
Sucker Punch,12,"Legendary Pictures, Warner Bros., Lennox House Films, Cruel and Unusual Films"
Red Riding Hood,15,"Appian Way, Warner Bros., Random Films"
The Twilight Saga: Breaking Dawn - Part 1,41,"Summit Entertainment, Sunswept Entertainment, Total Entertainment, TSBD Canada Productions, Zohar International"
The Tree of Life,16,Fox Searchlight
I Am Number Four,16,"DreamWorks SKG, Reliance BIG Entertainment, Bay Films, Touchstone Pictures"
Rio,3,"Blue Sky Studios, Twentieth Century Fox Animation"
The Artist,10,"France 3 Cinéma, La Petite Reine, Studio 37, uFilm, Jouror Productions"
Zookeeper,9,"Columbia Pictures, Happy Madison Productions, Sony Pictures Releasing, Broken Road Productions, Metro-Goldwyn-Mayer (MGM)"
Cowboys & Aliens,16,"Imagine Entertainment, DreamWorks SKG, Universal Pictures, platinum studios, Reliance Entertainment"
War Horse,9,"DreamWorks SKG, Amblin Entertainment, Reliance Entertainment, Kennedy/Marshall Company, The"
50/50,5,"Summit Entertainment, Mandate Pictures"
Rango,5,"Paramount Pictures, Nickelodeon Movies, GK Films, Blind Wink, Paramount Animation"
The Change-Up,13,"Universal Pictures, Original Film, Relativity Media, Big Kid Pictures"
Hugo,4,"Paramount Pictures, Infinitum Nihil, GK Films"
The Lincoln Lawyer,18,"Lakeshore Entertainment, Sidney Kimmel Entertainment, Lionsgate"
Ghost Rider: Spirit of Vengeance,32,"Columbia Pictures, Imagenation Abu Dhabi FZ, Marvel Entertainment, Marvel Knights, Hyde Park Entertainment"
One Day,7,"Film 4, Color Force"
Killer Elite,12,"Current Entertainment, Omnilab Media, Ambience Entertainment, International Traders, Open Road Films"
The Rite,8,"New Line Cinema, Contrafilm, Mid Atlantic Films, Hungarian National Film Office, Lazio Film Commission"
Winnie the Pooh,15,"Walt Disney Pictures, Walt Disney Animation Studios"
The Three Musketeers,20,"Impact Pictures, Studio Babelsberg, Nouvelles Éditions de Films (NEF), New Legacy, Constantin Film Produktion"
Priest,6,"Screen Gems, Stars Road Entertainment, Buckaroo Entertainment, Michael De Luca Productions, TOKYOPOP"
Young Adult,11,"Paramount Pictures, Denver and Delilah Productions, Indian Paintbrush"
Abduction,9,"Lions Gate Films, Vertigo Entertainment, Gotham Group, Tailor Made, Mango Farms"
Unknown,7,"Studio Babelsberg, StudioCanal, Dark Castle Entertainment, TF1 Films Production, Canal+"
The Adjustment Bureau,21,"Universal Pictures, Media Rights Capital, Gambit Pictures, Electric Shepherd Productions"
Immortals,9,"Virgin Produced, Mark Canton Productions"
Larry Crowne,12,"Universal Pictures, Playtone Productions, Vendome Pictures"
Paul,4,"Universal Pictures, Big Talk Productions, Relativity Media, Working Title Films"
Colombiana,10,"TF1 Films Production, Canal+, CinéCinéma, Grive Productions, EuropaCorp"
Battle: Los Angeles,19,"Columbia Pictures, Original Film, Relativity Media"
Final Destination 5,19,"New Line Cinema, Practical Pictures, Parallel Zide"
Machine Gun Preacher,20,"Mpower Pictures, Relativity Media, 1984 Private Defense Contractors, Virgin Produced, Moonlighting Films"
Jack and Jill,13,"Columbia Pictures, Happy Madison Productions, Broken Road Productions"
What's Your Number?,19,"Regency Enterprises, Contrafilm, New Regency Pictures"
Season of the Witch,19,"Atlas Entertainment, Relativity Media"
My Week with Marilyn,20,"BBC Films, The Weinstein Company, UK Film Council, Lip Sync Post, Trademark Films"
We Bought a Zoo,15,"Twentieth Century Fox Film Corporation, Dune Entertainment, Vinyl Films, LBI Entertainment"
The Darkest Hour,16,"Summit Entertainment, Regency Enterprises, Bazelevs Production, The Jacobson Company, New Regency Pictures"
The Help,8,"DreamWorks SKG, 1492 Pictures, Participant Productions, Imagenation Abu Dhabi FZ, Reliance Entertainment"
The Grey,8,"Scott Free Productions, 1984 Private Defense Contractors, LD Entertainment, Open Road Films, Inferno Distribution"
Moneyball,9,"Columbia Pictures, Scott Rudin Productions"
The Roommate,12,"Vertigo Entertainment, Screen Gems"
Puss in Boots,13,DreamWorks
The Green Hornet,16,"Original Film, Sony Pictures Entertainment, Reliance BIG Entertainment"
Something Borrowed,18,"Alcon Entertainment, Wild Ocean Films, 2S Films"
Conan the Barbarian,19,"Dark Horse Entertainment, Nu Image Films, Paradox Entertainment, Nimar Studios, Millennium Films"
Johnny English Reborn,21,Universal Pictures
Contagion,9,"Double Feature Films, Regency Enterprises, Warner Bros., Participant Media, Imagenation Abu Dhabi FZ"
The Big Year,12,"Ingenious Media, Dune Entertainment, Fox 2000 Pictures, Deuce Three Productions, Sunswept Entertainment"
Beastly,7,"CBS Films, Mel's Cite du Cinema, Storefront Films"
A Very Harold & Kumar Christmas,31,"New Line Cinema, Mandate Pictures"
The Thing,9,"Universal Pictures, Strike Entertainment, Morgan Creek Productions"
Tower Heist,11,"Universal Pictures, Image Entertainment, Relativity Media, Rat Entertainment"
New Year's Eve,14,New Line Cinema
Your Highness,13,"Universal Pictures, Stuber Productions"
Apollo 18,9,"Bazelevs Production, Dimension Films, Bekmambetov Projects Ltd."
Fright Night,12,Touchstone Pictures
Happy Feet Two,14,"Village Roadshow Pictures, Warner Bros., Dr D Studios, Kennedy Miller Mitchell"
Scream 4,8,Dimension Films
Mars Needs Moms,15,Walt Disney Animation Studios
Attack the Block,16,"UK Film Council, Studio Canal, Film4"
Diary of a Wimpy Kid: Rodrick Rules,35,"Fox 2000 Pictures, Color Force"
Extremely Loud & Incredibly Close,33,"Paramount Pictures, Scott Rudin Productions, Warner Bros."
Alvin and the Chipmunks: Chipwrecked,36,Fox 2000 Pictures
Straw Dogs,10,Battleplan Productions
The Best Exotic Marigold Hotel,30,"Participant Media, Imagenation Abu Dhabi FZ"
The Smurfs,10,"Columbia Pictures, Sony Pictures Animation, Kerner Entertainment Company"
Hanna,5,"Focus Features, Neunte Babelsberg Film, Focus Features, Holleran Company, Sechzehnte Babelsberg Film"
Gnomeo & Juliet,15,"Starz Animation, Touchstone Pictures"
The Descendants,15,"Fox Searchlight Pictures, Dune Entertainment, Ad Hominem Enterprises"
Hop,3,"Universal Pictures, Illumination Entertainment"
The Rum Diary,13,"FilmEngine, Infinitum Nihil, GK Films"
The Guard,9,"UK Film Council, Crescendo Productions, Element Pictures, Irish Film Board, Prescience"
Our Idiot Brother,17,The Weinstein Company
Footloose,9,"Spyglass Entertainment, MTV Films"
Trespass,8,"Nu Image Films, Winkler Films, Millennium Films"
Carnage,7,"Wild Bunch, Zanagar Films, Canal+, Constantin Film Produktion, CinéCinéma"
The Ides of March,17,"Appian Way, Crystal City Entertainment, Cross Creek Pictures, Exclusive Media Group, Smokehouse Pictures"
Transformers: Dark of the Moon,30,"Paramount Pictures, Di Bonaventura Pictures, Hasbro, Indochina Productions"
Paranormal Activity 3,21,"Paramount Pictures, Blumhouse Productions, Room 101, Solana Films"
The Dilemma,11,"Imagine Entertainment, Universal Pictures, Spyglass Entertainment, Wild West Picture Show Productions"
Take Me Home Tonight,20,"Imagine Entertainment, Rogue Pictures, Relativity Media, Internationale Filmproduktion Blackbird Dritte"
The Muppets,11,Walt Disney Pictures
Seeking Justice,15,"Endgame Entertainment, Maguire Entertainment, Ram Bergman Productions, Aura Film Partnership, Fierce Entertainment"
Arthur,6,Warner Bros.
The Eagle,9,"Toledo Productions, Film4, Focus Features, Prime Focus, Twins Financing"
The Sitter,10,Twentieth Century Fox Film Corporation
J. Edgar,8,"Imagine Entertainment, Malpaso Productions, Wintergreen Productions"
Sanctum,7,"Universal Pictures, Wayfare Entertainment, Sanctum Australia, Relativity Media, Great Wight Productions/ Osford Films"
I Don't Know How She Does It,28,The Weinstein Company
A Dangerous Method,18,"Recorded Pictures Company, The Movie Network, Millbrook Pictures, Prospero Pictures, Lago Film"
Soul Surfer,11,"Mandalay Pictures, TriStar Pictures, Brookwell-McNamara Entertainment, FilmDistrict, Affirm Films"
30 Minutes or Less,18,Columbia Pictures
Hoodwinked Too! Hood VS. Evil,29,HW Two
Water for Elephants,19,"Ingenious Media, Dune Entertainment, Fox 2000 Pictures, Flashpoint Entertainment, Big Screen Productions"
Dream House,11,"Cliffjack Motion Pictures, Morgan Creek Productions"
Prom,4,"Walt Disney Pictures, Rickshaw Productions"
Killer Joe,10,"Voltage pictures, Worldview Entertainment, ANA Media, Picture Perfect (I)"
"Big Mommas: Like Father, Like Son",33,"Twentieth Century Fox Film Corporation, Regency Enterprises, New Regency Pictures, The Collective Studios, Runteldat Entertainment"
Dolphin Tale,12,"Alcon Entertainment, Arc Productions"
Xin shao lin si,15,"Emperor Motion Pictures, China Film Group Corporation (CFGC)"
Fast Five,9,"Universal Pictures, Original Film, One Race Productions"
Jumping the Broom,17,"TriStar Pictures, Stage 6 Films, Sony Pictures Worldwide Acquisitions (SPWA), TDJ Enterprises / New Dimensions Entertainment, Our Stories Films"
Monte Carlo,11,"Dune Entertainment, Regency Enterprises, Fox 2000 Pictures, DiNovi Pictures, Dune Entertainment III"
The Iron Lady,13,"UK Film Council, Canal+, DJ Films, CinéCinéma, Pathé"
The Devil's Double,18,"Corrino Media Corporation, Corsan, Staccato Films"
Shark Night,11,Incentive Filmed Entertainment
Atlas Shrugged Part I,21,Atlas Productions
This Must Be the Place,22,"ARP Sélection, Lucky Red, Indigo Film, Medusa Film, France 2 Cinéma"
Albert Nobbs,12,Chrysalis Films
Justin Bieber: Never Say Never,30,"Insurge Pictures, Magical Elves Productions, Scooter Braun Films"
"Jeff, Who Lives at Home",23,Indian Paintbrush
X-Men: First Class,18,"Ingenious Film Partners, Ingenious Media, Twentieth Century Fox Film Corporation, Donners' Company, Dune Entertainment"
The Lord of the Rings: The Two Towers,37,"WingNut Films, New Line Cinema, The Saul Zaentz Company"
Harry Potter and the Chamber of Secrets,39,"1492 Pictures, Warner Bros., Heyday Films, MIRACLE Productions GmbH & Co. KG"
Ice Age,7,"Twentieth Century Fox Film Corporation, Blue Sky Studios, Twentieth Century Fox Animation"
The Bourne Identity,19,"Universal Pictures, Kennedy/Marshall Company, The, Hypnotic, Kalima Productions GmbH & Co. KG, Stillking Films"
Resident Evil,13,"Impact Pictures, Davis-Films, New Legacy, Constantin Film Produktion"
Spider-Man,10,"Columbia Pictures, Marvel Enterprises"
Star Wars: Episode II - Attack of the Clones,44,Lucasfilm
Catch Me If You Can,19,"DreamWorks SKG, Kemp Company, Splendid Pictures"
Men in Black II,15,"Columbia Pictures, Amblin Entertainment, Columbia Pictures Corporation, Parkes+MacDonald Image Nation"
The Pianist,11,"Bac Films, Canal+Polska, Heritage Films, Studio Babelsberg, Agencja Produkcji Filmowej"
Minority Report,15,"DreamWorks SKG, Cruise/Wagner Productions, Amblin Entertainment, Twentieth Century Fox Film Corporation, Blue Tulip Productions"
Lilo & Stitch,13,"Walt Disney Pictures, Walt Disney Feature Animation"
The Transporter,15,"TF1 Films Productions, Current Entertainment, Canal+, EuropaCorp"
xXx,3,"Columbia Pictures, Original Film, Revolution Studios"
Treasure Planet,15,"Walt Disney Pictures, Walt Disney Feature Animation"
Die Another Day,15,Eon Productions
28 Days Later...,16,"DNA Films, British Film Council"
Maid in Manhattan,17,"Columbia Pictures, Hughes Entertainment, Revolution Studios, Shoelace Productions"
Blade II,8,"New Line Cinema, Marvel Entertainment, LLC, Amen Ra Films, Milk & Honey, Imaginary Forces"
Gangs of New York,17,"Miramax Films, Initial Entertainment Group (IEG), Alberto Grimaldi Productions"
Panic Room,10,"Columbia Pictures Corporation, Hofflund/Polone, Indelible Productions"
Stuart Little 2,15,"Columbia Pictures, Sony Pictures Entertainment"
National Lampoon’s Van Wilder,31,"Tapestry Films, Artisan Entertainment"
8 Mile,6,"Imagine Entertainment, Mikona Productions GmbH & Co. KG"
Mr. Deeds,9,"New Line Cinema, Columbia Pictures Corporation, Out of the Blue... Entertainment, Happy Madison Productions"
Two Weeks Notice,16,"Village Roadshow Pictures, Castle Rock Entertainment, NPV Entertainment, Fortis Films"
Signs,5,"Kennedy/Marshall Company, The, Touchstone Pictures, Blinding Edge Pictures"
The Ring,8,"DreamWorks SKG, BenderSpink, Parkes+MacDonald Image Nation"
A Walk to Remember,18,"Pandora Pictures, Warner Bros."
My Big Fat Greek Wedding,24,"MPH Entertainment, Playtone Productions, Gold Circle Films"
About a Boy,11,Universal Pictures
Collateral Damage,17,"David Foster Productions, Bel Air Entertainment, Warner Bros., Hacienda Productions"
Phone Booth,11,Fox 2000 Pictures
Star Trek: Nemesis,18,Paramount Pictures
Equilibrium,11,"Dimension Films, Blue Tulip Productions"
The Good Girl,13,"Fox Searchlight Pictures, Hungry Eye Lowland Pictures B.V., Flan de Coco Films"
The Hours,9,"Paramount Pictures, Miramax Films, Scott Rudin Productions"
Road to Perdition,17,"DreamWorks SKG, The Zanuck Company, Twentieth Century Fox Film Corporation"
Austin Powers in Goldmember,27,"New Line Cinema, Eric's Boy, Team Todd, Moving Pictures, Gratitude International"
The Santa Clause 2,18,Walt Disney Pictures
Insomnia,8,"Section Eight, Alcon Entertainment, Witt/Thomas Productions"
