original_title,title_length,production_companies
Lone Survivor,13,"Universal Pictures, Weed Road Pictures, Herrick Entertainment, Leverage Management, Closest to the Hole Productions"
Dallas Buyers Club,18,"Universal Studios, Universal Pictures, Voltage Pictures, Truth Entertainment"
R.I.P.D.,8,"Universal Pictures, Original Film, Dark Horse Entertainment"
Planes,6,"Walt Disney Pictures, Walt Disney Animation Studios"
Spring Breakers,15,"RabbitBandini Productions, Division Films, Pop Films, Radar Pictures, Muse Productions"
The Call,8,"TriStar Pictures, WWE Studios, Troika Pictures, Emergency Films, Apotheosis Media Group"
Evil Dead,9,"TriStar Pictures, Ghost House Pictures, FilmDistrict"
Last Vegas,10,"Laurence Mark Productions, CBS Films, Outlaw Sinema, Good Universe, Gidden Media"
The Family,10,"Canal Plus, TF1 Films Production, Grive Productions, EuropaCorp, Relativity Media"
The Place Beyond the Pines,26,"Sidney Kimmel Entertainment, Electric City Entertainment, Verisimilitude"
Grown Ups 2,11,"Columbia Pictures, Happy Madison Productions, Sony Pictures Entertainment (SPE)"
The Hangover Part III,21,"Legendary Pictures, Green Hat Films"
The Croods,10,DreamWorks Animation
Homefront,9,"Millennium Films, Open Road Films"
Escape Plan,11,"Summit Entertainment, Atmosphere Entertainment MM, Emmett/Furla Films, Mark Canton Productions, Envision Entertainment"
Carrie,6,"Screen Gems, Metro-Goldwyn-Mayer (MGM), Misher Films"
Captain Phillips,16,Columbia Pictures
The Counselor,13,"Ingenious Media, Fox 2000 Pictures, Scott Free Productions, Kanzaman, Nick Wechsler Productions"
White House Down,16,"Columbia Pictures, Centropolis Entertainment, Iron Horse Entertainment (II), Mythology Entertainment (II)"
Begin Again,11,"Likely Story, Apatow Productions, Exclusive Media Group, Sycamore Pictures"
The Big Wedding,15,"Millenium Films, Two Ton Films"
Jack the Giant Slayer,21,"New Line Cinema, Original Film, Legendary Pictures, Warner Bros., Big Kid Pictures"
Runner Runner,13,"20th Century Fox, Double Feature Films, Appian Way, Stone Village Pictures, New Regency Pictures"
Bullet to the Head,18,"Dark Castle Entertainment, After Dark Films, IM Global, Automatik Entertainment, Silver Reel"
What If,7,"Fastnet Films, Caramel Film, No Trace Camping"
Delivery Man,12,"DreamWorks SKG, Touchstone Pictures"
This Is the End,15,"Columbia Pictures, Mandate Pictures, Sony Pictures Entertainment (SPE), Point Grey Pictures"
Jackass Presents: Bad Grandpa,29,"Paramount Pictures, MTV Films, Dickhouse Productions"
Parker,6,SND
After Earth,11,"Columbia Pictures, Blinding Edge Pictures, Overbrook Entertainment"
The Heat,8,"Ingenious Film Partners, Ingenious Media, Twentieth Century Fox Film Corporation, Chernin Entertainment, Big Screen Productions"
Saving Mr. Banks,16,"Walt Disney Pictures, BBC Films, Ruby Films, Essential Media & Entertainment, Hopscotch Features"
Oculus,6,"Intrepid Pictures, Blumhouse Productions, Relativity Media, WWE Studios, MICA Entertainment"
The Lone Ranger,15,"Walt Disney Pictures, Jerry Bruckheimer Films, Infinitum Nihil, Silver Bullet Productions (II), Blind Wink Productions"
Gangster Squad,14,"Village Roadshow Pictures, Lin Pictures, Warner Bros., Langley Park Production"
Identity Thief,14,"Stuber Productions, Aggregate Films, DumbDumb"
All Is Lost,11,"Sudden Storm Productions, FilmNation Entertainment, Treehouse Pictures, Before the Door Pictures, Washington Square Films"
Texas Chainsaw 3D,17,"Nu Image Films, Lions Gate"
Trance,6,"Cloud Eight Films, Pathé, Decibel Films, Film4"
Anchorman 2: The Legend Continues,33,"Paramount Pictures, Gary Sanchez Productions, Apatow Productions"
Oz: The Great and Powerful,26,"Walt Disney Pictures, Roth Films"
Turbo,5,DreamWorks Animation
Redemption,10,Lionsgate
Pain & Gain,11,"Paramount Pictures, De Line Pictures"
The Host,8,"Nick Wechsler Productions, Open Road Films, Silver Reel, Chockstone Pictures"
Oldboy,6,"Vertigo Entertainment, 40 Acres & A Mule Filmworks, Good Universe, OB Productions"
Mama,4,"Universal Pictures, Toma 78, De Milo"
Admission,9,Focus Features
The Butler,10,"Laura Ziskin Productions, Lee Daniels Entertainment, Follow Through Productions, Salamander Pictures, Pam Williams Productions"
Movie 43,8,"Greenestreet Films, Relativity Media, Virgin Produced, Wessler Entertainment, Witness Protection Films"
21 & Over,9,"Relativity Media, Virgin Produced, Mandeville Films, SkyLand Entertainment"
Escape from Planet Earth,24,"Rainmaker Entertainment, Mainframe Entertainment, Weinstein Company, The"
Grudge Match,12,"Gerber Pictures, Warner Bros."
Belle,5,"Isle of Man Film, DJ Films, British Film Institute (BFI), Pinewood Studios, Metrol Technology"
Machete Kills,13,"Open Road Films, Overnight Films, AR Films, Aldamisa Entertainment, Demarest Films"
Safe Haven,10,"Temple Hill Productions, Relativity Media"
The Bling Ring,14,"Pathé Distribution, A24"
Empire State,12,"Grindstone Entertainment Group, Cheetah Vision, Voltage Pictures, Emmett/Furla Films, Envision Entertainment Corporation"
Behind the Candelabra,21,HBO Films
Cloudy with a Chance of Meatballs 2,35,"Columbia Pictures, Sony"
Blue Jasmine,12,Perdido Productions
Side Effects,12,"Di Bonaventura Pictures, Endgame Entertainment, Universal, Open Road Films"
La migliore offerta,19,"Paco Cinematografica, Warner Bros., Regione Lazio, Business Location Sudtirol Alto Adige, Friuli Venezia Giulia Film Commission"
The Incredible Burt Wonderstone,31,"New Line Cinema, Benderspink, Carousel Productions"
Mud,3,"FilmNation Entertainment, Everest Entertainment"
The Railway Man,15,"Archer Street Productions, Lionsgate, Pictures in Paradise, Silver Reel, Latitude Media"
Broken City,11,"Regency Enterprises, Inferno International, 1984 Private Defense Contractors, Closest to the Hole Productions, New Regency Pictures"
Walking With Dinosaurs,22,20th Century Fox
The Frozen Ground,17,"Grindstone Entertainment Group, Cheetah Vision, K5 International, Paradox Entertainment, Emmett/Furla Films"
The Smurfs 2,12,"Columbia Pictures, Sony Pictures Animation, Kerner Entertainment Company, Hemisphere Media Capital, NeoReel"
42,2,Warner Bros.
The Fifth Estate,16,"DreamWorks SKG, Participant Media, Reliance Entertainment, Touchstone Pictures, Anonymous Content"
Blood Ties,10,"Wild Bunch, LGM Productions, Les Productions du Trésor, Mars Distribution, Canal+"
The Wolverine,13,"Twentieth Century Fox Film Corporation, Donners' Company, Marvel Entertainment, Bad Hat Harry Productions, Big Screen Productions"
Snitch,6,"Front Street Productions, Participant Media, Imagenation Abu Dhabi FZ, Exclusive Media Group, Spitfire Pictures"
Free Birds,10,"Reel FX Creative Studios, Relativity Media"
Nebraska,8,"Paramount Vantage, Bona Fide Productions"
Scary Movie 5,13,Dimension Films
Man of Tai Chi,14,"Universal Pictures, Village Roadshow Pictures, China Film Group Corporation (CFGC), Company Films, Dalian Wanda Group"
Baggage Claim,13,Sneak Preview Productions
August: Osage County,20,"Jean Doumanian Productions, Smokehouse Pictures"
Paranormal Activity: The Marked Ones,36,"Blumhouse Productions, Room 101, Solana Films"
Jobs,4,"Open Road Films, Dillywood, Five Star Institute, Silver Reel"
Paranoia,8,"Gaumont, Kintop Pictures, Reliance Entertainment, Relativity Media, IM Global"
Out of the Furnace,18,"Appian Way, Scott Free Productions, Relativity Media, Energy Entertainment, Red Granite Pictures"
Fast & Furious 6,16,"Universal Pictures, Original Film, One Race Productions, Dentsu, Relativity Media"
Battle of the Year,18,Screen Gems
Khumba,6,Triggerfish Animation
Black Nativity,14,"Fox Searchlight Pictures, Fox Searchlight"
Metallica: Through the Never,28,"Exclusive Media Group, Picturehouse Entertainment"
Legends of Oz: Dorothy's Return,31,"Prana Animation Studios, Summertime Entertainment"
The East,8,Scott Free Productions
The Best Man Holiday,20,Universal
The Last Exorcism Part II,25,"StudioCanal, CBS Films"
Mandela: Long Walk to Freedom,29,"Distant Horizons, Film Afrika Worldwide, Videovision Entertainment, Pathe, Origin Pictures"
Philomena,9,"BBC Films, The Weinstein Company, Baby Cow Productions, Pathé, Yucaipa Films"
Diana,5,"Ecosse Films, Le Pacte, Scope Pictures, Film i Väst, Filmgate Films"
Getaway,7,"Dark Castle Entertainment, Signature Pictures, After Dark Films, Silver Reel, Saints LA"
The Internship,14,"Twentieth Century Fox Film Corporation, Regency Enterprises, 21 Laps Entertainment, Wild West Picture Show Productions, TSG Entertainment"
Сталинград,20,Art Pictures Studio
Harry Potter and the Goblet of Fire,35,"Patalex IV Productions Limited, Warner Bros., Heyday Films"
Batman Begins,13,"DC Comics, Legendary Pictures, Warner Bros., DC Entertainment, Syncopy"
"The Chronicles of Narnia: The Lion, the Witch and the Wardrobe",62,"Walt Disney, Walden Media"
V for Vendetta,14,"Studio Babelsberg, DC Comics, Virtual Studios, Anarchos Productions, Silver Pictures"
Sin City,8,"Dimension Films, Troublemaker Studios, Miramax"
Charlie and the Chocolate Factory,33,"Village Roadshow Pictures, The Zanuck Company, Warner Bros., Tim Burton Productions, Plan B Entertainment"
Star Wars: Episode III - Revenge of the Sith,44,Lucasfilm
The Hitchhiker's Guide to the Galaxy,36,"Spyglass Entertainment, Everyman Pictures, Hammer & Tongs, Touchstone Pictures"
The Island,10,"DreamWorks SKG, Warner Bros., Parkes/MacDonald Productions"
Madagascar,10,"DreamWorks SKG, Pacific Data Images (PDI), DreamWorks Animation"
Fantastic Four,14,"Twentieth Century Fox Film Corporation, 1492 Pictures, Constantin Film Produktion, Marvel Enterprises, Kumar Mobiliengesellschaft mbH & Co. Projekt Nr. 3 KG"
Constantine,11,"Village Roadshow Pictures, DC Comics, Lonely Film Productions GmbH & Co. KG., Donners' Company, Branded Entertainment/Batfilm Productions"
Wedding Crashers,16,"New Line Cinema, Tapestry Films, Avery Pix"
Æon Flux,9,"Paramount Pictures, Lakeshore Entertainment, MTV Films, Colossal Pictures, Valhalla Motion Pictures"
The Pacifier,12,"Walt Disney Pictures, Spyglass Entertainment"
War of the Worlds,17,"Paramount Pictures, DreamWorks SKG, Cruise/Wagner Productions, Amblin Entertainment"
Memoirs of a Geisha,19,"DreamWorks SKG, Spyglass Entertainment, Columbia Pictures Corporation, Red Wagon Productions"
The 40 Year Old Virgin,22,"Universal Pictures, Apatow Productions"
Chicken Little,14,"Walt Disney Pictures, Walt Disney Feature Animation"
Hitch,5,"Columbia Pictures Corporation, Overbrook Entertainment"
Transporter 2,13,"Canal Plus, Twentieth Century Fox Film Corporation, Current Entertainment, TF 1 Film Productions, TPS Star"
Nanny McPhee,12,"Universal Pictures, Three Strange Angels, Studio Canal, Metro-Goldwyn-Mayer (MGM), Working Title Films"
Kingdom of Heaven,17,"Studio Babelsberg, Twentieth Century Fox Film Corporation, Scott Free Productions, Kanzaman, Dune Films"
Monster-in-Law,14,"New Line Cinema, Spring Creek Productions, BenderSpink, Kumar Mobiliengesellschaft mbH & Co. Projekt Nr. 1 KG"
King Kong,9,"WingNut Films, Universal Pictures, Big Primate Pictures, MFPV Film"
Be Cool,7,"Double Feature Films, Jersey Films, Nina Saxon Film Design, Metro-Goldwyn-Mayer (MGM)"
Into the Blue,13,"Columbia Pictures Corporation, Mandalay Pictures, Metro-Goldwyn-Mayer (MGM)"
Pride & Prejudice,17,"Universal Pictures, StudioCanal, Scion Films, Focus Features, Working Title Films"
Brokeback Mountain,18,"River Road Entertainment, Alberta Film Entertainment, Focus Features, Good Machine"
Robots,6,"Blue Sky Studios, Twentieth Century Fox Animation"
xXx: State of the Union,23,"Original Film, Columbia Pictures Corporation, Revolution Studios"
The Sisterhood of the Traveling Pants,37,"DiNovi Pictures, Alcon Entertainment, Alloy Entertainment"
Mr. & Mrs. Smith,16,"20th Century Fox, Weed Road Pictures, Dutch Oven, New Regency Productions, Summit Entertainment"
The Legend of Zorro,19,"Amblin Entertainment, Columbia Pictures Corporation"
Lord of War,11,"Saturn Films, Ascendant Pictures, Endgame Entertainment, Entertainment Manufacturing Company, Rising Star"
Elektra,7,"Twentieth Century Fox Film Corporation, Regency Enterprises, Epsilon Motion Pictures, New Regency Pictures, Marvel Enterprises"
Corpse Bride,12,"Tim Burton Animation Company, Will Vinton Studios, Warner Bros., Tim Burton Productions, Laika Entertainment"
The Curse of the Were-Rabbit,28,"Aardman Animations, DreamWorks Animation"
Rumor Has It...,15,"Village Roadshow Pictures, Section Eight, Spring Creek Productions, Warner Bros."
The Jacket,10,"Section Eight, Mandalay Pictures, VIP 3 Medienfonds, 2929 Productions, Rising Star"
Jarhead,7,"Universal Pictures, Neal Street Productions, Red Wagon Entertainment, Motion Picture KAPPA Produktionsgesellschaft"
Just Like Heaven,16,"DreamWorks SKG, MacDonald/Parkes Productions"
Herbie Fully Loaded,19,"Walt Disney Pictures, Robert Simonds Productions"
Elizabethtown,13,"Paramount Pictures, Cruise/Wagner Productions, Vinyl Films, KMP Film Invest"
Four Brothers,13,"Paramount Pictures, Di Bonaventura Pictures"
Cinderella Man,14,"Miramax Films, Imagine Entertainment, Universal Pictures, Parkway Pictures (I), Touchstone Pictures"
Match Point,11,DreamWorks
Hoodwinked!,11,"The Weinstein Company, Kanbar Entertainment, Blue Yonder Films"
Hide and Seek,13,"Twentieth Century Fox Film Corporation, Fox 2000 Pictures, Josephson Entertainment, MBC Beteiligungs Filmproduktion"
Bewitched,9,"Columbia Pictures Corporation, Red Wagon Entertainment, Bewitched"
Doom,4,"Di Bonaventura Pictures, John Wells Productions, Reaper Productions, Stillking Films, Babelsberg Film"
Cheaper by the Dozen 2,22,Twentieth Century Fox Film Corporation
Fever Pitch,11,"Fox 2000 Pictures, Wildgaze Films, Alan Greenspan Productions, Mars Media Beteiligungs, Flower Films (II)"
Proof,5,"Miramax Films, Endgame Entertainment, Hart-Sharp Entertainment"
The Interpreter,15,"Universal Pictures, StudioCanal, Mirage Enterprises, Working Title Films, Misher Films"
The Brothers Grimm,18,"The Weinstein Company, Summit Entertainment, Atlas Entertainment, Mosaic Media Group, Reforma Films"
An Unfinished Life,18,"Miramax Films, Revolution Studios, Persistent Entertainment, Initial Entertainment Group (IEG), The Ladd Company"
Hostage,7,"Miramax Films, Cheyenne Enterprises, Yari Film Group, Stratus Film Co., Syndicate Films International"
The Dukes of Hazzard,20,"Village Roadshow Pictures, Gerber Pictures, Warner Bros., WV Films III"
Munich,6,"DreamWorks SKG, Universal Pictures, Amblin Entertainment, Peninsula Films, Alliance Atlantis Communications"
The Exorcism of Emily Rose,26,"Lakeshore Entertainment, Firm Films, Screen Gems"
Thank You for Smoking,21,"Fox Searchlight Pictures, Room 9 Entertainment"
Syriana,7,"Section Eight, Warner Bros., Participant Media, FilmWorks, 4M"
Derailed,8,"Miramax Films, Di Bonaventura Pictures, Patalex V Productions Limited"
The Skeleton Key,16,"Universal Pictures, MFPV Film, Double Feature Films, ShadowCatcher Entertainment, Daniel Bobker Productions"
Racing Stripes,14,Alcon Entertainment
"Good Night, and Good Luck.",26,"Warner Independent Pictures (WIP), Section Eight Productions"
Coach Carter,12,"Paramount Pictures, MTV Films, Tollin/Robbins Productions"
A History of Violence,21,"New Line Cinema, DC Comics, BenderSpink"
The Amityville Horror,21,"Platinum Dunes, Dimension Films, Metro-Goldwyn-Mayer (MGM), Radar Pictures"
Fun with Dick and Jane,22,"Imagine Entertainment, Columbia Pictures Corporation, JC 23 Entertainment"
Unleashed,9,"Canal Plus, Current Entertainment, Clubdeal, TF1 Films Production, EuropaCorp"
Rebound,7,"Twentieth Century Fox Film Corporation, Robert Simonds Productions, Runteldat Entertainment"
Guess Who,9,"Columbia Pictures, Regency Enterprises, 3 Arts Entertainment, Tall Trees Productions"
Two for the Money,17,"Universal Pictures, Morgan Creek Productions"
Flightplan,10,"Imagine Entertainment, Touchstone Pictures"
Assault on Precinct 13,22,"Rogue Pictures, Why Not Productions, Liaison Films, Biscayne Pictures"
Broken Flowers,14,"Bac Films, Focus Features, Five Roses"
The Weather Man,15,"Paramount Pictures, Escape Artists, Kumar Mobiliengesellschaft mbH & Co. Projekt Nr. 2 KG"
Land of the Dead,16,"Universal Pictures, Atmosphere Entertainment MM, Romero-Grunwald Productions, Exception Wild Bunch"
Walk the Line,13,"Tree Line Films, Konrad Pictures, Catfish Productions, Fox 2000 Pictures, Mars Media Beteiligungs"
A Lot Like Love,15,"Mile High Productions, Kevin Messick Productions, Touchstone Pictures, Beacon Pictures"
Get Rich or Die Tryin',22,"Paramount Pictures, MTV Films, Cent Productions Inc."
Kicking & Screaming,19,Universal Pictures
Cursed,6,"Craven-Maddalena Films, Outerbanks Entertainment, Dimension Films, Kalis Productions GmbH & Co. Zweite KG"
Stay,4,"20th Century Fox, Regency Enterprises"
The Longest Yard,16,"Paramount Pictures, Columbia Pictures Corporation, MTV Films, Happy Madison Productions, Callahan Filmworks"
Are We There Yet?,17,"Columbia Pictures, Revolution Studios, Cube Vision"
A Sound of Thunder,18,"Epsilon Motion Pictures, Franchise Pictures, Baldwin Entertainment Group, Dante Entertainment, Crusader Entertainment"
The Fog,7,"Revolution Studios, Debra Hill Productions"
Stealth,7,"Laura Ziskin Productions, Original Film, Columbia Pictures Corporation, Phoenix Pictures, AFG Talons Productions"
The Wedding Date,16,"Universal Pictures, 26 Films"
BloodRayne,10,Boll KG
Sahara,6,"Paramount Pictures, Bristol Bay Productions, Baldwin Entertainment Group, Desertlands Entertainment, Mace Neufeld Productions"
The Matador,11,Miramax Films
Capote,6,"Sony Pictures Classics, Cooper's Town Productions, Eagle Vision Inc., Manitoba Film and Video Production Tax Credit, Province of British Columbia Production Services Tax Credit"
Valiant,7,"Vanguard Films, Scanbox"
The Constant Gardener,21,"Studio Babelsberg, Epsilon Motion Pictures, UK Film Council, Scion Films, Focus Features"
House of Wax,12,"Village Roadshow Pictures, Dark Castle Entertainment, Warner Bros."
The Great Raid,14,"Miramax Films, Lawrence Bender Productions, Marty Katz Productions"
Domino,6,"New Line Cinema, Davis-Films, Metropolitan Filmexport, Scott Free Productions, Domino 17521"
Beauty Shop,11,Metro-Goldwyn-Mayer (MGM)
The Adventures of Sharkboy and Lavagirl,39,"Columbia Pictures Corporation, Dimension Films"
The Greatest Game Ever Played,29,Walt Disney Pictures
The Three Burials of Melquiades Estrada,39,"The Javelina Film Company, EuropaCorp"
Goal!: The Dream Begins,23,"Touchstone Pictures, Milkshake Films, Hargitay & Hargitay Pictures in Motion"
White Noise,11,"Universal Pictures, Brightlight Pictures, Endgame Entertainment, The Movie Network (TMN), Canadian Film or Video Production Tax Credit (CPTC)"
Sky High,8,"Walt Disney Pictures, Gunn Films, Max Stronghold Productions Inc."
Red Eye,7,"DreamWorks SKG, Craven-Maddalena Films, BenderSpink"
Everything is Illuminated,25,"Big Beach Productions, Stillking Films, Warner Independent Pictures (WIP), Telegraph Films"
"Yours, Mine & Ours",18,"Paramount Pictures, Columbia Pictures Corporation, Nickelodeon Movies, O.N.C. Entertainment, Robert Simonds Productions"
Hustle & Flow,13,MTV Films
Alone in the Dark,17,"Boll Kino Beteiligungs GmbH & Co. KG, Brightlight Pictures, Herold Productions, Lionsgate, Infogrames Entertainment"
Boogeyman,9,"Ghost House Pictures, Senator International, Screen Gems, Pacific Renaissance Pictures Ltd."
The Cave,8,"Lakeshore Entertainment, Cinerenta Medienbeteiligungs KG, Screen Gems, Cineblue Internationale Filmproduktionsgesellschaft, City Productions"
Rent,4,"Columbia Pictures, 1492 Pictures, Revolution Studios"
North Country,13,"Warner Bros., Participant Media, Nick Wechsler Productions"
Bad News Bears,14,Paramount Pictures
Because of Winn-Dixie,21,Twentieth Century Fox Film Corporation
Lords of Dogtown,16,"Columbia Pictures, TriStar Pictures"
Dark Water,10,"Vertigo Entertainment, Touchstone Pictures, Post No Bills Films, Pandemonium Productions"
Underworld: Evolution,21,"Lakeshore Entertainment, Screen Gems"
Pirates of the Caribbean: Dead Man's Chest,42,"Walt Disney Pictures, Jerry Bruckheimer Films, Second Mate Productions"
Cars,4,"Walt Disney Pictures, Pixar Animation Studios"
Casino Royale,13,Eon Productions
The Da Vinci Code,17,"Columbia Pictures, Imagine Entertainment, Skylark Productions, Government of Malta"
Step Up,7,"Summit Entertainment, Offspring Entertainment, Touchstone Pictures, Eketahuna LLC"
Ice Age: The Meltdown,21,"Blue Sky Studios, Twentieth Century Fox Animation"
Mission: Impossible III,23,"Paramount Pictures, Cruise/Wagner Productions, Studio Babelsberg, MI 3 Film, China Film Co-Production Corporation"
The Devil Wears Prada,21,"Twentieth Century Fox Film Corporation, Dune Entertainment, Major Studio Partners, Peninsula Films, Fox 2000 Pictures"
The Departed,12,"Vertigo Entertainment, Media Asia Films, Warner Bros., Initial Entertainment Group (IEG), Plan B Entertainment"
The Holiday,11,"Columbia Pictures, Universal Pictures, Waverly Films, Relativity Media"
The Prestige,12,"Touchstone Pictures, Syncopy"
Night at the Museum,19,"Ingenious Film Partners, Twentieth Century Fox Film Corporation, 1492 Pictures, 21 Laps Entertainment"
Babel,5,"Paramount Vantage, Media Rights Capital, Anonymous Content, Central Films"
Children of Men,15,"Universal Pictures, Strike Entertainment, Hit & Run Productions"
Borat: Cultural Learnings of America for Make Benefit Glorious Nation of Kazakhstan,83,"Twentieth Century Fox Film Corporation, Four By Two Productions"
Click,5,"Original Film, Columbia Pictures Corporation, Revolution Studios, Happy Madison Productions"
The Break-Up,12,"Universal Pictures, Mosaic Media Group, Wild West Picture Show Productions"
Inside Man,10,"Imagine Entertainment, Universal Pictures"
Over the Hedge,14,"Pacific Data Images (PDI), DreamWorks Animation"
Perfume: The Story of a Murderer,32,"Davis-Films, Nouvelles Éditions de Films (NEF), Rising Star, VIP Medienfonds 4, Ikiru Films"
Blood Diamond,13,"Bedford Falls Productions, Lonely Film Productions GmbH & Co. KG., Virtual Studios, Spring Creek Productions, Warner Bros."
Crank,5,"Lions Gate Films, Lakeshore Entertainment, GreeneStreet Films, Radical Media"
Lucky Number Slevin,19,"The Weinstein Company, FilmEngine, Capitol Films, Ascendant Pictures, VIP Medienfonds 4"
Eight Below,11,"Walt Disney Pictures, Spyglass Entertainment, Vertigo Entertainment, Kennedy/Marshall Company, The, Mandeville Films"
Final Destination 3,19,"New Line Cinema, Zide-Perry Productions, Kumar Mobiliengesellschaft mbH & Co. Projekt Nr. 1 KG, Hard Eight Pictures, Matinee Pictures"
Silent Hill,11,"Silent Hill DCP Inc., Davis-Films, Konami"
She's the Man,13,"DreamWorks SKG, Lakeshore Entertainment"
The Fountain,12,"Regency Enterprises, Warner Bros., Muse Entertainment Enterprises, Protozoa Pictures, New Regency Pictures"
Happy Feet,10,"Village Roadshow Pictures, Kennedy Miller Productions, Kingdom Feature Productions, Warner Bros., Animal Logic"
Rocky Balboa,12,"Columbia Pictures, Revolution Studios, Rogue Marble, Metro-Goldwyn-Mayer (MGM)"
Flushed Away,12,"Aardman Animations, DreamWorks Animation"
The Wild,8,"Walt Disney Pictures, Contrafilm, C.O.R.E. Feature Animation, Hoytyboy Pictures, Nigel Productions"
Déjà Vu,9,"Jerry Bruckheimer Films, Scott Free Productions, Touchstone Pictures"
Eragon,6,"Ingenious Film Partners, Twentieth Century Fox Film Corporation, Dune Entertainment, Major Studio Partners, Fox 2000 Pictures"
The Lake House,14,"Village Roadshow Pictures, Vertigo Entertainment, Sound for Film, Warner Bros."
Scary Movie 4,13,Dimension Films
Monster House,13,"Columbia Pictures, Amblin Entertainment, Sony Pictures Animation, Sony Pictures Entertainment, ImageMovers"
Failure to Launch,17,"Paramount Pictures, Scott Rudin Productions, Failure to Launch Productions"
Apocalypto,10,"Icon Productions, Icon Entertainment International, Touchstone Pictures"
The Ant Bully,13,"Warner Bros. Pictures, DNA Films, Legendary Pictures, Playtone Production, Warner Bros. Animation"
The Hills Have Eyes,19,"Dune Entertainment, Major Studio Partners, Craven-Maddalena Films"
Just My Luck,12,"Regency Enterprises, Cheyenne Enterprises, New Regency Pictures"
The Good Shepherd,17,"Universal Pictures, American Zoetrope, Morgan Creek Productions"
Miami Vice,10,"Universal Pictures, Forward Pass, Motion Picture ETA Produktionsgesellschaft, Foqus Arte Digital, Metropolis Films"
John Tucker Must Die,20,"Twentieth Century Fox Film Corporation, Dune Entertainment, Major Studio Partners, Landscape Entertainment, John US Productions"
Tristan & Isolde,16,"Twentieth Century Fox Film Corporation, Epsilon Motion Pictures, Franchise Pictures, Scott Free Productions, World 2000 Entertainment"
Flags of Our Fathers,20,"DreamWorks SKG, Amblin Entertainment, Malpaso Productions, Warner Bros."
Curious George,14,"Imagine Entertainment, Universal Pictures, Universal Animation Studios"
Smokin' Aces,12,"Universal Pictures, StudioCanal, Relativity Media, Scion Films, Working Title Films"
RV,2,Columbia Pictures
We Are Marshall,15,"Legendary Pictures, Thunder Road Pictures, Wonderland Sound and Vision, Warner Bros."
The Illusionist,15,"Michael London Productions, Stillking Films, Bob Yari Productions, Bull's Eye Entertainment, Contagious Entertainment"
The Contract,12,"Nu Image Entertainment, 3L Filmverleih"
All the King's Men,18,"Columbia Pictures Corporation, Rising Star, Relativity Media, Phoenix Pictures, VIP 4 Medienfonds"
Big Momma's House 2,19,"Twentieth Century Fox Film Corporation, Regency Enterprises, Epsilon Motion Pictures, Firm Films, Deep River Productions"
Basic Instinct 2,16,"Intermedia Films, Kanzaman, C-2 Pictures, IMF Internationale Medien und Film GmbH & Co. 3. Produktions KG"
Clerks II,9,"The Weinstein Company, View Askew Productions"
Talladega Nights: The Ballad of Ricky Bobby,43,"Columbia Pictures, Apatow Productions"
The Pursuit of Happyness,24,"Columbia Pictures Corporation, Escape Artists, Relativity Media, Overbrook Entertainment"
